<?xml version="1.0" encoding="iso-8859-1"?>
<!DOCTYPE ruleset SYSTEM "kbml.dtd">

<!-- @version: -->

<ruleset name="Test KB from test.xml">
  <rule>
    <hypothesis>H007</hypothesis>
    <condition>
      <test op="yes"><var>bool1</var></test>
    </condition>
  </rule>
  <rule>
    <hypothesis>H2</hypothesis>
    <condition>
      <test op="gt"><var>bool2</var><var>bool31</var></test>
      <test op="lt"><var>bool2</var><const>103.56</const></test>
      <test op="gt"><var>bool32</var><const>3.56</const></test>
      <test op="yes"><var>bool22</var></test>
    </condition>
    <action>
      <command op="set-num">
	<var>x1</var>
	<const>221.65</const>
      </command>
      <command op="set-bool">
	<var>newb1</var>
	<const>true</const>
      </command>
    </action>
  </rule>
  <rule>
    <hypothesis>H2Diff</hypothesis>
    <condition>
      <test op="lt"><var>bool2</var><const>7.0</const></test>
    </condition>
    <action>
      <command op="set-num">
	<var>x2</var>
	<const>221.65</const>
      </command>
      <command op="set-bool">
	<var>b3</var>
	<const>true</const>
      </command>
      <command op="set-bool">
	<var>b4</var>
	<const>false</const>
      </command>
    </action>
  </rule>
  <rule>
    <hypothesis>H2</hypothesis>
    <condition>
      <test op="yes"><var>bool23</var></test>
      <test op="lt"><var>bool2</var><const>0.0</const></test>
    </condition>
  </rule>
  <rule>
    <hypothesis>H1</hypothesis>
    <condition>
      <test op="no"><var>bool3</var></test>
    </condition>
  </rule>
  <rule>
    <hypothesis>H1</hypothesis>
    <condition>
      <test op="yes"><var>bool4</var></test>
      <test op="yes"><var>H6</var></test>
      <test op="no"><var>bool5</var></test>
      <test op="no"><var>H6</var></test>
    </condition>
  </rule>
  <rule>
    <hypothesis>H6</hypothesis>
    <condition>
      <test op="yes"><var>bool14</var></test>
      <test op="no"><var>bool15</var></test>
    </condition>
  </rule>
</ruleset>
